{
  "tenantId": "11111111-1111-4111-8111-111111111111",
  "periodId": "bp-a0000000000000000000000000000001",
  "scope": "tenant",
  "workflowKey": null,
  "periodStart": "2026-09-01T00:00:00.000000Z",
  "periodEnd": "2026-10-01T00:00:00.000000Z",
  "currency": "USD",
  "limitMicroUsd": 5000000,
  "reservedMicroUsd": 2500,
  "settledMicroUsd": 1200,
  "heldMicroUsd": 0,
  "status": "open",
  "createdAt": "2026-08-31T12:00:00.000000Z",
  "closedAt": null
}
