{
  "tenantId": "11111111-1111-4111-8111-111111111111",
  "periodId": "bp-a0000000000000000000000000000002",
  "scope": "workflow_key",
  "workflowKey": "copy-review",
  "periodStart": "2026-09-01T00:00:00.000000Z",
  "periodEnd": "2026-10-01T00:00:00.000000Z",
  "currency": "USD",
  "limitMicroUsd": 1000000,
  "reservedMicroUsd": 0,
  "settledMicroUsd": 0,
  "heldMicroUsd": 2500,
  "status": "closed",
  "createdAt": "2026-08-31T12:00:00.000000Z",
  "closedAt": "2026-09-29T18:00:00.000000Z"
}
